{
  "version": 1,
  "layer": "aoa-playbooks",
  "artifact_identity": {
    "artifact_class": "playbook_registry_bundle",
    "surface_state": "public_source_authored_playbook_registry",
    "owner_repo": "aoa-playbooks",
    "authority_ref": "README.md#current-public-surfaces",
    "producer": "aoa-playbooks source-authored registry plus deterministic playbook-owned surface generators",
    "consumer_expectation": "playbook consumers verify registry digests, ABI identity, SLSA/in-toto generation provenance, validate_playbooks, generated surface parity, and owner boundaries before using playbook scenario metadata",
    "privacy_boundary": "public playbook metadata and generated playbook-owned composition/readout refs only; no private run logs, secrets, live runtime state, memo truth, proof verdicts, or routing authority",
    "content_identity": "generated/playbook_registry.min.json plus playbook-owned generated composition, activation, review, and federation surfaces",
    "abi_epoch": "aoa_playbooks_registry_bundle_v1",
    "contract_version": "schemas/playbook-registry.schema.json@aoa_playbooks_registry_bundle_v1#artifact_identity",
    "trust_layer": [
      "abi_contract_signature",
      "slsa_in_toto"
    ],
    "verification": [
      "python scripts/validate_playbooks.py",
      "python scripts/release_check.py",
      "abyss-machine artifacts verify BUNDLE_DIR --json"
    ]
  },
  "playbooks": [
    {
      "id": "AOA-P-0001",
      "name": "repo-bootstrap",
      "status": "active",
      "summary": "Bootstraps a new repository or layer with bounded scaffolding, docs, validation, and contributor guidance.",
      "scenario": "repo_bootstrap",
      "trigger": "new_layer_or_repo",
      "prerequisites": [
        "clear_repo_role"
      ],
      "participating_agents": [
        "architect",
        "coder",
        "reviewer"
      ],
      "required_skill_families": [
        "change-protocol",
        "verification",
        "architecture"
      ],
      "evaluation_posture": "required",
      "memory_posture": "light_recall",
      "fallback_mode": "review_required",
      "expected_artifacts": [
        "README",
        "CHARTER",
        "ROADMAP",
        "validator"
      ]
    },
    {
      "id": "AOA-P-0002",
      "name": "safe-change-rollout",
      "status": "active",
      "summary": "Coordinates a bounded change with explicit validation, review posture, and fallback handling.",
      "scenario": "safe_change",
      "trigger": "bounded_change_request",
      "prerequisites": [
        "scoped_task"
      ],
      "participating_agents": [
        "coder",
        "reviewer"
      ],
      "required_skill_families": [
        "change-protocol",
        "verification",
        "review"
      ],
      "evaluation_posture": "strict",
      "memory_posture": "light_recall",
      "fallback_mode": "rollback",
      "expected_artifacts": [
        "diff",
        "verification_report",
        "review_notes"
      ]
    },
    {
      "id": "AOA-P-0003",
      "name": "bounded-research-pass",
      "status": "active",
      "summary": "Runs a constrained research or exploration pass with explicit questions, synthesis, and next-step artifacts.",
      "scenario": "bounded_research",
      "trigger": "research_need",
      "prerequisites": [
        "bounded_question"
      ],
      "participating_agents": [
        "architect",
        "reviewer"
      ],
      "required_skill_families": [
        "research",
        "synthesis",
        "boundary-checks"
      ],
      "evaluation_posture": "required",
      "memory_posture": "bounded_recall",
      "fallback_mode": "safe_stop",
      "expected_artifacts": [
        "research_summary",
        "decision_notes",
        "next_steps"
      ]
    },
    {
      "id": "AOA-P-0004",
      "name": "release-prep",
      "status": "active",
      "summary": "Prepares a repository or layer for merge or release with bounded checks, summaries, and merge posture.",
      "scenario": "release_prep",
      "trigger": "merge_or_release_window",
      "prerequisites": [
        "candidate_changes_present"
      ],
      "participating_agents": [
        "reviewer",
        "evaluator"
      ],
      "required_skill_families": [
        "review",
        "evaluation",
        "release-prep"
      ],
      "evaluation_posture": "strict",
      "memory_posture": "light_recall",
      "fallback_mode": "review_required",
      "expected_artifacts": [
        "merge_readiness_notes",
        "summary",
        "validation_output"
      ]
    },
    {
      "id": "AOA-P-0005",
      "name": "memory-curation-pass",
      "status": "active",
      "summary": "Curates bounded memory outputs from scattered inputs while keeping memory distinct from proof and execution.",
      "scenario": "memory_curation",
      "trigger": "memory_cleanup_or_capture",
      "prerequisites": [
        "candidate_memory_inputs"
      ],
      "participating_agents": [
        "memory-keeper",
        "reviewer"
      ],
      "required_skill_families": [
        "memory-curation",
        "provenance",
        "review"
      ],
      "evaluation_posture": "required",
      "memory_posture": "deep_recall",
      "fallback_mode": "handoff",
      "expected_artifacts": [
        "curated_memory_output",
        "provenance_notes"
      ]
    },
    {
      "id": "AOA-P-0006",
      "name": "self-agent-checkpoint-rollout",
      "status": "experimental",
      "summary": "Coordinates a bounded self-agent or policy-sensitive change through approval, rollback, health checks, and an improvement log.",
      "scenario": "self_agent_checkpoint",
      "trigger": "self_change_or_policy_sensitive_change",
      "prerequisites": [
        "constitution_or_source_of_truth_check_defined",
        "approval_gate_defined",
        "rollback_marker_available",
        "health_check_defined"
      ],
      "participating_agents": [
        "architect",
        "coder",
        "reviewer",
        "memory-keeper"
      ],
      "required_skill_families": [
        "source-of-truth",
        "approval-gate",
        "change-protocol",
        "memory-curation"
      ],
      "evaluation_posture": "strict",
      "memory_posture": "bounded_recall",
      "fallback_mode": "rollback",
      "expected_artifacts": [
        "approval_record",
        "rollback_marker",
        "health_check",
        "improvement_log"
      ],
      "eval_anchors": [
        "aoa-approval-boundary-adherence",
        "aoa-bounded-change-quality"
      ]
    },
    {
      "id": "AOA-P-0007",
      "name": "witness-to-compost-pilot",
      "status": "experimental",
      "summary": "Routes a nontrivial run through witness capture, bounded memory writeback, and compost promotion into a note or principle candidate.",
      "scenario": "witness_compost_pilot",
      "trigger": "nontrivial_run_needs_reviewable_trace",
      "prerequisites": [
        "trace_boundary_defined",
        "redaction_posture_defined",
        "reviewable_summary_defined",
        "compost_target_defined"
      ],
      "participating_agents": [
        "architect",
        "coder",
        "reviewer",
        "memory-keeper"
      ],
      "required_skill_families": [
        "source-of-truth",
        "change-protocol",
        "memory-curation",
        "review"
      ],
      "evaluation_posture": "strict",
      "memory_posture": "deep_recall",
      "fallback_mode": "handoff",
      "expected_artifacts": [
        "witness_trace_json",
        "witness_summary_md",
        "compost_note",
        "principle_candidate",
        "canon_bundle"
      ],
      "eval_anchors": [
        "aoa-witness-trace-integrity",
        "aoa-compost-provenance-preservation"
      ]
    },
    {
      "id": "AOA-P-0008",
      "name": "long-horizon-model-tier-orchestra",
      "status": "experimental",
      "summary": "Coordinates a long-horizon route through explicit model-tier handoffs, deep escalation gates, and distillation posture.",
      "scenario": "model_tier_orchestration",
      "trigger": "long_horizon_or_high_cost_route",
      "prerequisites": [
        "tier_registry_defined",
        "bounded_route_goal_defined",
        "verification_boundary_defined",
        "distillation_target_defined"
      ],
      "participating_agents": [
        "architect",
        "coder",
        "reviewer",
        "memory-keeper"
      ],
      "required_skill_families": [
        "change-protocol",
        "review",
        "memory-curation",
        "research"
      ],
      "evaluation_posture": "strict",
      "memory_posture": "bounded_recall",
      "fallback_mode": "handoff",
      "expected_artifacts": [
        "route_decision",
        "bounded_plan",
        "verification_result",
        "transition_decision",
        "distillation_pack"
      ],
      "eval_anchors": [
        "aoa-long-horizon-depth",
        "aoa-tool-trajectory-discipline"
      ],
      "return_posture": "artifact_anchor",
      "return_anchor_artifacts": [
        "route_decision",
        "bounded_plan",
        "verification_result"
      ],
      "return_reentry_modes": [
        "previous_phase",
        "router_reentry",
        "safe_stop"
      ],
      "memo_recall_modes": [
        "semantic",
        "procedural"
      ],
      "memo_scope_default": "workspace",
      "memo_scope_ceiling": "ecosystem",
      "memo_read_path": "inspect_capsule_then_expand",
      "memo_checkpoint_posture": "not_needed",
      "memo_source_route_policy": "required"
    },
    {
      "id": "AOA-P-0009",
      "name": "restartable-inquiry-loop",
      "status": "experimental",
      "summary": "Runs a checkpoint-based long-horizon inquiry loop that can pause, relaunch, and preserve axis through bounded artifacts.",
      "scenario": "restartable_inquiry",
      "trigger": "long_horizon_philosophy_or_architecture_question",
      "prerequisites": [
        "checkpoint_contract_defined",